EVENT_ID,NAME_2,BEGIN_LOCATION,BEGIN_DATE,BEGIN_TIME,EVENT_TYPE,MAGNITUDE,TOR_F_SCALE,DEATHS_DIRECT,INJURIES_DIRECT,DAMAGE_PROPERTY_NUM,DAMAGE_CROPS_NUM,STATE_ABBR,CZ_TIMEZONE,MAGNITUDE_TYPE,EPISODE_ID,CZ_TYPE,CZ_FIPS,WFO,INJURIES_INDIRECT,DEATHS_INDIRECT,SOURCE,FLOOD_CAUSE,TOR_LENGTH,TOR_WIDTH,BEGIN_RANGE,BEGIN_AZIMUTH,END_RANGE,END_AZIMUTH,END_LOCATION,END_DATE,END_TIME,BEGIN_LAT,BEGIN_LON,END_LAT,END_LON,EVENT_NARRATIVE,EPISODE_NARRATIVE,ABSOLUTE_ROWNUMBER,ID_0,,
5422944,FRANKLIN CO.,FRANKLIN SPGS,9/16/2004,1645,Tornado, ,F2,1,1,75000,0,GA,EST, ,1180302,C,119,GSP,0,0,NWS STORM SURVEY, ,5.5,50,7,W,7,W,FRANKLIN SPGS,9/16/2004,1653,34.28333,-83.26667,34.33333,-83.26667,"This tornado touched down west of Franklin Springs, then moved north-northwest, damaging several homes, businesses, and vehicles as it tracked toward Carnesville. Numerous trees and power lines were also blown down. A 38-year-old woman was killed when the vehicle she was driving was hit by a falling tree. A passenger in the vehicle received minor injuries.",,83,244,,
87295,POLK CO.,SENEY,3/15/2008,1125,Tornado, ,EF3,1,1,3500000,0,GA,EST-5, ,15271,C,233,FFC,0,0,NWS Storm Survey, ,3.18,880,1,ENE,3,NNE,HAMLET,3/15/2008,1128,34.09,-85.11,34.11,-85.06,"A ground and aerial survey conducted by the National Weather Service Forecast Office in Peachtree City, GA in cooperation with the Georgia State Patrol and local emergency managers confirmed that an EF3 tornado had touched down in extreme north central Polk county, just east of the town of Seney near the intersection of Georgia Highway 101 and the Floyd county line.  The tornado then tracked approximately 16 miles across extreme northeast Polk, extreme southeast Floyd, and into southern Bartow county before lifting southwest of Cartersville.  The tornado had a maximum path width of 1/2 mile with maximum wind speeds estimated at 150 mph.  EF3 damage was noted at three locations along the path of the tornado as it tracked across the three counties.  The tornado made an approximate 3-mile track across far northern Polk county.||Within Polk county, four homes were destroyed, two sustained major damage, five had minor damage, and 5 others were minimally impacted.  All of these were in the far north central and northeast part of the county between Georgia Highway 101 and the Floyd county line where Bon Loop Road intersects the Floyd county line.  One fatality and one injury occurred on Bon Loop Road where a home was destroyed.  In addition, several county outbuildings, barns, shops, vehicles, one motor home, one travel trailer, one dog kennel business, several fences were heavily damaged.  Several livestock were either injured or killed.  Hundreds of trees and power lines were down in the area, including several high tension power lines support structures, which were heavily damaged.","The pattern that began to evolve on March 14th continued and intensified on March 15th.  A stationary front remained draped across north Georgia from near Atlanta to Athens.  South of this front, the air mass was becoming increasingly warm, moist and unstable.  Meanwhile, aloft, a low amplitude, yet vigorous short wave embedded within a fast zonal flow, was tracking rapidly eastward from the mid south into the southeast.  Strong shear and high helicity combined with the unstable air mass and the frontal boundary to allow repeated severe thunderstorms to develop and track eastward along the boundary across north Georgia.  The activity began early in the day as a complex of thunderstorms moved into the area from Alabama and continued until nearly midnight.  As the day progressed, especially during the afternoon, the development of the activity gradually progressed further south and by midnight had reached the south and southeast parts of the state.  Numerous severe thunderstorms and tornadic supercells were observed throughout the day.||Historical records indicate that this was one of the most significant severe weather days for the Peachtree City Weather Forecast Office with more events and warnings than had been observed since May 2003.",84,244,,
87298,FLOYD CO.,WAX,3/15/2008,1128,Tornado, ,EF3,1,1,1000000,0,GA,EST-5, ,15271,C,115,FFC,0,0,NWS Storm Survey, ,2.86,880,2,SSE,4,ESE,WAX,3/15/2008,1132,34.11,-85.09,34.11,-85.04,"A ground and aerial storm survey conducted by the National Weather Service Forecast Office in Peachtree City Georgia in cooperation with the Georgia State Patrol confirmed that the EF3 tornado, that first touched down in extreme north central Polk county just east of Seney, continued on an east-northeastward track across extreme southeast Floyd county.  Approximately three miles of the 16-mile long path of this tornado was within Floyd county.  The maximum path was once again estimated to be approximately 1/2 mile.  Despite the relatively short time frame and small area of the county affected, considerable damage was inflicted to the far southeast part of the county.  A home was destroyed on Old Wax Road, resulting in additional fatality and injury.  Dozens of trees and several power lines were also down in this part of the county.||Overall damage consisted of 20 homes, 10 of which were destroyed, and 10 with minor damage.","The pattern that began to evolve on March 14th continued and intensified on March 15th.  A stationary front remained draped across north Georgia from near Atlanta to Athens.  South of this front, the air mass was becoming increasingly warm, moist and unstable.  Meanwhile, aloft, a low amplitude, yet vigorous short wave embedded within a fast zonal flow, was tracking rapidly eastward from the mid south into the southeast.  Strong shear and high helicity combined with the unstable air mass and the frontal boundary to allow repeated severe thunderstorms to develop and track eastward along the boundary across north Georgia.  The activity began early in the day as a complex of thunderstorms moved into the area from Alabama and continued until nearly midnight.  As the day progressed, especially during the afternoon, the development of the activity gradually progressed further south and by midnight had reached the south and southeast parts of the state.  Numerous severe thunderstorms and tornadic supercells were observed throughout the day.||Historical records indicate that this was one of the most significant severe weather days for the Peachtree City Weather Forecast Office with more events and warnings than had been observed since May 2003.",85,244,,
9996316,HEARD CO., ,3/5/1989,2000,Tornado,0,F2,1,0,2500000,0,GA,CST, , ,C,149, ,0,0, , ,20,167,0, ,0, , ,3/5/1989,2000,33.17,-85.23,33.37,-84.97,,,86,244,,
10318914,GWINNETT CO.,Grayson,6/27/1994,215,Tornado,0,F2,1,0,5000000,0,GA,EST, , ,C,135, ,0,0, , ,8,200,4,W,6,E,of Grayson,6/27/1994,230, , , , ,"A tornado touched down near Georgia Highway 124, four miles  west of Grayson then moved east and tore into the Williums  Acres subdivisions near Grayson.  Five large homes were destroyed, 20 homes received major damage while another 34  had minor damage inflicted. 
One large two-story brick home (5300 square feet) took a direct hit in the Greystone subdivision and was reduced to rubble.  
The only known fatality occurred in the lower bedroom ,of this structure.  The tornado threw the second story of the ,house 50 feet off the foundation while the first floor disin,tegrated. Ironically, upon inspection of the dislodged second floor of the home, stuffed animals remained intact and undisturbed on a  bedroom window sill.  
Most of the homes that suffered major or complete damage in the Greystone subdivision were in a clear-cut zone.  Those homes  that were in wooded areas received the least amount of damage.   At Pinehurst Trace road near the Grayson subdivision, another home was lifted and blown across the road were it broke in half. 
Most of the damage was concentrated near Georgia Highway 84, one mile southwest of Grayson and along Ozora Church Road, two miles southeast of Grayson.  
Damage estimates to property from this tornado was estimated at nearly 1 million dollars.  (F10P) ",,87,244,,
5639755,DE KALB CO.,DUNWOODY,4/8/1998,2335,Tornado, ,F2,1,0,25000000,0,GA,EST, ,2074574,C,89,FFC,0,0, , ,4,800, , ,4,E,DUNWOODY,4/8/1998,2340,33.95,-84.33,33.95,-84.27,The damage path began just northeast of Perimeter Mall in Dunwoody and extended well into Gwinnett county. There was significant widespread damage to trees and homes. One person was killed when a tree fell on his home. DeKalb College's north campus was closed after several buildings sustained major damage.,,88,244,,
5132159,COLQUITT CO.,CROSLAND,2/14/2000,139,Tornado, ,F2,1,0,500000,0,GA,EST, ,1091370,C,71,TAE,0,0,EMERGENCY MANAGER, ,1,200,2,NE,2,NE,CROSLAND,2/14/2000,142,31.31667,-83.63333,31.33333,-83.61667,A strong tornado tore through extreme northeast Colquitt County near Crosland toppling trees and power lines before it moved into extreme southwest Tift County.  Several mobile homes were damaged.  One woman  was killed  in a mobile home just northeast of  Crosland when a large tree and another mobile home were blown against her home.  Colquitt County was declared a federal disaster area.  Reported by a amateur radio operator and the Colquitt County EMA.,,89,244,,
5475737,CARROLL CO.,ROOPVILLE,8/29/2005,1530,Tornado, ,F2,1,0,4400000,0,GA,EST, ,1198457,C,45,FFC,0,0,NWS STORM SURVEY, ,4,200,3,SE,3,SE,ROOPVILLE,8/29/2005,1538,32.55,-83.88333,32.6,-83.88333,"A National Weather Service Damage Survey Team, in conjunction with the Carroll County Emergency Manager and Chief of Fire and Rescue operations, concluded that the F2 tornado, which began just south of Glenloch in Heard county, continued north into Carroll county.  The tornado entered Carroll county approximately three miles southeast of Roopville and continued north at 30-35 mph to a point about three miles northeast of Roopville.  The overall path length within Carroll county was 4.0 miles with an approximate path width of 200 yards.  Extensive damage occurred along the path of the tornado.  A total of 17 large chicken houses were destroyed along with 1,000,000 chickens.  This resulted in agricultural damages alone in Carroll county of $3,000,000.  A 40-year old man was killed while stepping outside his house to check on the status of his poultry and one of his chicken houses.  Other livestock, including cattle and horses were also killed along the tornado path.  Several homes and vehicles were also damaged or destroyed.  One Chevrolet pickup truck was flipped over by the tornado onto a pile of bricks and wooden panels.  Damage to homes and residential property from the tornado was estimated at $1,435,800.  Overall damage in Carroll county from the tornado and subsequent thunderstorm wind was estimated at $5,235,800.  All together 30 homes in the county suffered moderate damage, with another 100 homes sustaining minor damage.",,90,244,,
68914,TURNER CO.,ASHBURN,12/15/2007,2120,Tornado, ,EF1,1,0,1250000,0,GA,EST-5, ,12569,C,287,TAE,0,0,NWS Storm Survey, ,3.5,125,1,SW,3,NE,ASHBURN,12/15/2007,2122,31.6898,-83.682,31.7256,-83.6399,"A tornado touched down just southwest of Ashburn and tracked northeast through the city.  Numerous trees were toppled, with several on top of houses and vehicles.  Four mobile homes were destroyed and 39 frame homes were damaged.  The tornado's winds twisted steel beams and tore the roofs off of two peanut warehouses.  Numerous businesses were damaged.  The tornado snapped the tops of pine trees just northeast of Ashburn.  A semi traveling north on Interstate 75 near mile marker 83 was blown into an embankment.  The driver was killed on impact.","An warm and unstable air mass collided along a strong cold front to produce reports of damaging thunderstorm winds and a pair of tornadoes across portions of southwest Georgia.  Unfortunately, a fatality occurred when one of the tornadoes tossed a semi into an enbankment off Interstate 75 just northeast of Ashburn.",91,244,,
301771,RABUN CO.,PERSIMMON,4/27/2011,2200,Tornado, ,EF3,1,0,5000000,0,GA,EST-5, ,49792,C,241,GSP,0,0,NWS Storm Survey, ,14.17,900,8,SW,0,N,MOUNTAIN CITY,4/27/2011,2216,34.825,-83.5961,34.9267,-83.379,"The path of an intense tornado, which was likely the continuation of the Habersham County tornado, was found in Rabun County beginning in the Lake Burton area. Damage was first found near a marina on Wildcat Creek Cove. A fire department building near this location was destroyed. As the tornado moved northeast across Moccasin Creek, it intensified and widened to around one half mile. Several large lake homes were completely destroyed in this area. Another home slid off its foundation into the lake. The tornado continued northeast across the Moccasin Creek peninsula and over the main channel of Lake Burton. Severe damage was observed again along the north shore of Timpson Cove, roughly paralleling Meeting House Mountain Rd. Several large luxury homes along the shore were destroyed, while many others received major structural damage. One 83-year-old man was killed in one of these homes. In addition to the major structural damage, thousands of trees were blown down in the Lake Burton area. The tornado weakened as it crossed highway 76 just northeast of Timpson Cove, proceeding to Black Rock State Park, where hundreds of additional trees were blown down. As the tornado continued northeast from the state park, it intensified slightly as it moved over a residential area in Mountain City. Half of the roof was blown off a condominium building, while surrounding homes had minor to moderate roof damage. The tornado crossed highway 441 just north of Mountain City and appeared to lift in the Oakey Mountain area. The tornado was very unusual not only for its strength but also for the rugged terrain in which it occurred. It was the first tornado to hit Rabun County since 1983 and the first F3 or EF3 tornado in the county's recorded history.","An historic tornado outbreak affected areas from the Deep South to the Mid-Atlantic states April 27-28. A strong tornado touched down in Rabun County late on the 27th, with additional tornadoes affecting the North Carolina foothills during the early morning hours of the 28th. At least three supercell thunderstorms crossed the western Carolinas and northeast Georgia during this time. A greater number of supercells and tornadoes affected areas to the west of the Appalachians. Scattered areas of straight line wind damage and large hail also accompanied the storms.",92,244,,
10319388,DOUGHERTY CO.,Albany,11/7/1995,1359,Tornado,0,F2,0,36,10000000,0,GA,EST, , ,C,95, ,0,0, , ,5,150,4,SW,3,SE,Albany,11/7/1995,1405, , , , ,"A tornado first touched down on the north side of the Albany Dougherty County Airport then moved east north-east for five miles to just past U.S. Highway 19.  In two spots along the path the tornado lifted briefly.  One of these breaks in the damage path occurred at an elementary school that was in session.  The worst damage was to a Winn Dixie grocery store where many of the 36 injuries occurred.  One side of the store was pulled out and collapsed to the side parking area.  In the parking lot, numerous cars were moved about and a few turned over.  Over 40 homes were destroyed with over 50 more severely damaged.  Five businesses were severely damaged. ",,93,244,,
10009521,COBB CO., ,11/22/1992,1044,Tornado,0,F4,0,34,25000000,0,GA,EST, , ,C,67, ,0,0, , ,13,867,0, ,0, , ,11/22/1992,1044,33.92,-84.67,34.08,-84.52,,,94,244,,
673013,WORTH CO.,RED ROCK,1/22/2017,1537,Tornado, ,EF3,0,31,5000000,0,GA,EST-5, ,112358,C,321,TAE,0,0,NWS Storm Survey, ,14.01,2200,4,WNW,5,E,DOLES,1/22/2017,1550,31.5989,-83.9964,31.7096,-83.7969,"The EF3 tornado from Dougherty county continued all the way across Worth county into Turner county as an EF3 tornado with max winds estimated near 150 mph.  In Worth County, it caused extensive damage to homes along Jewel Crowe Road. This was consistent with EF3 damage. Damage to homes and outbuildings consistent with EF2 damage was observed along Camp Osborn Road. A concrete block church on Zion Church Road was completely destroyed, justifying an EF3 rating at that point.  Damage cost was estimated.","A multi-day severe weather event struck the southeast January 21-22, 2017 with three rounds of severe weather moving through the area. The first round of severe weather started during the mid-morning hours on Saturday, January 21, 2017 as a squall line pushed into southeast Alabama and the Florida panhandle. As it pushed eastward nine warnings were issued with a total of 18 damaging wind reports (trees and power lines downed) related to these storms. ||After a brief lull during Saturday evening as the aforementioned squall line washed out near the Gulf Coast, strong southerly flow returned late Saturday night as a warm front pushed northward across the Florida Big Bend and southern Georgia. Initially with this late Saturday night to early Sunday morning event, a strong supercell moved across southern Georgia producing a tornado that moved across Thomas and northern Brooks Counties. This was the first tornado across the area with this multi- day event. From the same supercell that produced the tornado in Thomas and northern Brooks Counties, another tornado developed that tracked across Brooks, Berrien and Cook Counties and this tornado resulted in 11 fatalities. This overnight into early Sunday morning event produced one more tornado, an EF-1 that struck Lowndes County. ||A final round of severe weather moved through Sunday afternoon as a warm front continued to push northward into southeast Alabama and southern Georgia while the main low and trailing cold front pushed eastward across the Florida panhandle and offshore regions. This afternoon round of supercells first produced a tornado in Henry County, AL. An hour and a half after the Henry County tornado, two more tornadoes developed, an EF-2 that struck Clay, Randolph and Calhoun Counties (Georgia) and an EF-1 tornado that hit Franklin County, FL. After this, a long tracked tornado (track length of more than 70 miles) moved across Albany (Dougherty County) and into Worth and Turner Counties, causing extensive damage and five fatalities. ||Overall this multi-day event resulted in seven tornadoes, 16 deaths and numerous injuries. Three days of damage surveys were conducted to rate the tornadoes on the Enhanced Fujita scale.",95,244,,
9996351,BULLOCH CO., ,5/3/1984,1300,Tornado,0,F2,0,30,2500000,0,GA,CST, , ,C,31, ,0,0, , ,20,200,0, ,0, , ,5/3/1984,1300,32.37,-81.88,32.52,-81.63,,,96,244,,
9994206,COFFEE CO., ,4/18/1969,935,Tornado,0,F2,0,28,2500000,0,GA,CST, , ,C,69, ,0,0, , ,30.8,233,0, ,0, , ,4/18/1969,935,31.43,-83.13,31.57,-82.63,,,97,244,,
5686494,DOOLY CO.,DRAYTON,4/15/1999,920,Tornado, ,F3,0,28,10000000,0,GA,EST, ,1502589,C,93,FFC,0,0,NWS STORM SURVEY, ,14.5,700,2,SW,5,ENE,VIENNA,4/15/1999,930,32.05,-83.97,32.12,-83.72,"An NWS Storm survey showed the tornado touched down along highway 27 at the Flint River near Drayton. The tornado hopped eastward along highway 27, demolishing pecan orchards and barns, before  devastating the town of Vienna. It exited the town between 2 schools, with only minor damage to either. It later crossed I-75 between Georgia highways 27 and 215, blocking the Interstate with debris. The storm lifted a short distance east of there between Noble Gin Road and Smyrna Church Road. The EMA director said 25 percent of homes and businesses were destroyed or severely damaged. Of the 28 injuries the most serious was a broken leg. Newspaper accounts reported 69 houses, 15 mobile homes, and 9 businesses were destroyed. Another 256 homes, 12 churches, 10 mobile homes, and 6 businesses suffered damage. Three apartment complexes were ruined and 70 power poles were ripped from the ground. Around 400 people were left homeless in a town with a population of over 2700.",,98,244,,
10007562,COBB CO., ,3/29/1991,730,Tornado,0,F3,0,25,25000000,0,GA,EST, , ,C,67, ,0,0, , ,5,1320,0, ,0, , ,3/29/1991,730,33.83,-84.65,33.9,-84.58,,,99,244,,
304667,WALKER CO.,HINKLES,4/27/2011,1645,Tornado, ,EF2,0,25,5000000,0,GA,EST-5, ,50924,C,295,FFC,0,0,NWS Storm Survey, ,9.8,1056,2,WSW,1,ENE,SPENCER HILLS,4/27/2011,1657,34.8924,-85.423,34.9531,-85.2666,"This tornado is a continuation of the EF3 tornado that originated in DeKalb county, Alabama, tracked across central Dade county, Georgia, and then across northern Walker county, Georgia before lifting just before reaching the Tennessee line.  The tornado weakened to an EF2 strength before entering Walker county, and continued as an EF2 to EF1 across much of its path within Walker county.  The tornado crossed into Walker county approximately five miles west-southwest of Chattanooga Valley and lifted just west of Fort Oglethorpe near the intersection of U.S. Highway 27 and Georgia Highway 2.  Thousands of trees and dozens of power lines were taken down by the tornado.  Dozens of homes suffered severe damage, especially across the northern part of the county.   Seven homes were completely destroyed.  The most severe damage was noted in the Flintstone area.  While no fatalities occurred within Walker county, there were 25 injuries, mostly at the severely damaged or destroyed homes.  The most severe damage with this tornado occurred in Dade county.||Damage in Walker county consists of seven destroyed homes, 26 with major damage, and 35 with minor damage.||[04/27-04/28/11: Tornado #2, County #2-2, EF2, Dade-Walker, 2011:011].","A highly diffluent, deep upper trough, centered across Texas, took on a negative tilt and began to rotate northeast during this period.  A strong maritime-Pacific (mP) cold front accompanied the upper trough through the mid-south into the southeast from the early morning hours of the 27th to the early morning hours of the 28th.  An intense low-level jet with winds in excess of 70 knots was noted in advance of this system and tracked across the mid-south early on the 27th, across north Alabama and north Georgia into the early morning hours of the 28th.  West-southwest winds aloft were highly diffluent and near 200 mph across this same region.  The strong low-level jet brought unseasonably, warm, moist Gulf air northward in advance of the mP cold front.  Dewpoints in the 70s and maximum temperatures in the 80s combined with the extremely strong low-level and upper jets to create an almost perfect environment for severe thunderstorms and large devastating tornadoes.  Indeed, the tornado outbreak that affected much of the eastern U.S., but particularly the south central and southeastern U.S. during this period, was unprecedented and likely the largest recorded in U.S. history.  The tornado outbreak that accompanied this combination of weather features has been termed the 2011 Super Outbreak, an outbreak even worse than the 1994 and 1974 super tornado outbreaks across the eastern U.S.  The outbreak affected the South Central, Southeast, Midwest, and even the usually less tornado prone Northeastern United States.  Over 330 tornadoes were reported during this outbreak which began on April 25th and continued into the 28th affecting 21 states from Texas to New York.  Even isolated tornadoes were noted in Canada.  Nearly 350 people died from these tornadoes, of which over 230 of these were in Alabama alone.  Four tornadoes on April 27th in Alabama and Mississippi were ranked EF5, the highest tornado damage rating on the Enhanced Fujita Scale.  On average, there is only one EF5 tornado per year in the entire U.S.||Widespread and destructive tornadoes occurred on each day of the outbreak, but April 27th was clearly one of the most prolific and destructive tornado days in U.S. history, probably only surpassed by the Tri-State outbreak of 1925 and the Tupelo-Gainesville outbreak of 1936.  The 24-hour period from 8 am April 27th to 8 a.m. April 28th is listed by the National Oceanic and Atmospheric Administration (NOAA) as the fourth deadliest tornado outbreak in U.S. history, with the 24 hours commencing April 28th at 8 a.m. as the fifth deadliest tornado day in U.S. history.  It has also been determined to be the costliest tornado outbreaks and one of the costliest natural disasters in the U.S., even after adjustments for inflation, with total damages estimated to exceed $10 billion. ||Georgia was heavily impacted by this tornado outbreak, especially the northwest part of the state which bore the brunt of the massive supercell thunderstorms producing killer tornadoes that tracked east-northeast from northern Alabama during the late evening.  All together, there were 15 tornadoes affecting 28 counties within the Peachtree City, Georgia 96-county warning area (CWA) of North and Central Georgia.  All of these occurred within a 24-hour period commencing at 8 am April 27th.  One of these tornadoes was rated an EF4, the first EF4 tornado in Georgia since the Palm Sunday outbreak in 1994.  In addition, there were also four EF3 tornadoes.  Fifteen tornado-related deaths were observed in north and central Georgia, the most tornado-related deaths within the Peachtree City, Georgia forecast area since its inception in 1994.  The previous highest tornado-related death total was 12 on March 20, 1998, when a tornado struck Gainesville, Georgia.||Finally, it should be noted that while the most significant period of severe weather during this outbreak for Georgia was from the afternoon of the 27th through the early morning hours of the 28th, there was an initial round of severe weather across northwest Georgia early on the 27th as a decaying line of severe thunderstorms moved into the region from northeast Alabama.  Widespread wind damage and even a few brief weaker tornadoes accompanied this system into the northwest counties of the state.",100,244,,
