EVENT_ID,NAME_2,BEGIN_LOCATION,BEGIN_DATE,BEGIN_TIME,EVENT_TYPE,MAGNITUDE,TOR_F_SCALE,DEATHS_DIRECT,INJURIES_DIRECT,DAMAGE_PROPERTY_NUM,DAMAGE_CROPS_NUM,STATE_ABBR,CZ_TIMEZONE,MAGNITUDE_TYPE,EPISODE_ID,CZ_TYPE,CZ_FIPS,WFO,INJURIES_INDIRECT,DEATHS_INDIRECT,SOURCE,FLOOD_CAUSE,TOR_LENGTH,TOR_WIDTH,BEGIN_RANGE,BEGIN_AZIMUTH,END_RANGE,END_AZIMUTH,END_LOCATION,END_DATE,END_TIME,BEGIN_LAT,BEGIN_LON,END_LAT,END_LON,EVENT_NARRATIVE,EPISODE_NARRATIVE,ABSOLUTE_ROWNUMBER,ID_0,,
10319147,BARTOW CO.,Adairsville,6/27/1994,100,Tornado,0,F1,0,2,500000,0,GA,EST, , ,C,15, ,0,0, , ,0.5,50,2,S,0, , ,6/27/1994,100, , , , ,"A short lived tornado touched down along Old U.S. Highway 41 two miles south of Adairsville.  The tornado destroyed three double-wide mobile homes and moderately damage three others. 
One double-wide trailer, occupied by a sleeping 5 year old female child, was tossed 125 feet which disintegrated on impact. The child was found in the rubble uninjured and still asleep. 
Twenty other homes received considerable roof and porch damage while several trees and 20 to 30 power lines were downed before the tornado dissipated. 
A 1000 electric customers were without power and 1900 residents lost telephone service for at least three hours in the Adairsville area. 
Two minor injuries were reported from wind blown shattered glass. ",,310,244,,
5639864,WALKER CO.,FLINTSTONE,4/16/1998,2220,Tornado, ,F1,0,2,100000,0,GA,EST, ,2074575,C,295,FFC,0,0, , ,0.5,50, , , , ,FLINTSTONE,4/16/1998,2220,34.93,-85.33,34.93,-85.33,"Police and fire officials reported a tornado. It apparently  touched down briefly destroying 3 trailers,  2 barns and a car. The roof was torn off of a house. Trees and power lines were downed.  The intensity, width and length were estimated.",,311,244,,
5647668,MONROE CO.,DAMES FERRY,5/3/1998,1830,Tornado, ,F0,0,2,100000,0,GA,EST, ,2077292,C,207,FFC,0,0, , ,1.5,100,2,SW,2,S,DAMES FERRY,5/3/1998,1835,33,-83.75,32.98,-83.73,"A severe thunderstorm cell spawned a tornado in the southeast corner of the county. The damage path was surveyed by a NWS employee who reported damage at the Whispering Pines mobile home park. Four mobile homes and a van were destroyed, mainly from trees falling on them.Two minor injuries occurred. Numerous trees and power lines were downed. Most of the damage appeared to be straight-line winds, but there was eveidence of circulation in some of the tree damage sites near the mobile home park. A metal outbuilding was lifted from a concrete pad and dropped 100 feet away, but items beneath the storage building remained intact on the pad. Eyewitness reports described the funnels as they ascended and descended. One person reported his truck was turned around in almost a complete circle but was left upright.",,312,244,,
5667344,MILLER CO.,COLQUITT,9/29/1998,1930,Tornado, ,F1,0,2,750000,0,GA,EST, ,2149870,C,201,TAE,0,0,EMERGENCY MANAGER, ,2,75,12,E,12,E,COLQUITT,9/29/1998,1930,31.17,-84.53,31.17,-84.53,"A strong F1 tornado destroyed a doublewide trailer off Cooktown Rd about 12 miles east of Colquitt.
Two of the three occupants were critically injured.  The tornado moved north and struck a neighboring farm and ripped roofs off outbuildings, twisted sheet metal, and destroyed a grain bin and farm equipment.",,313,244,,
5696417,CANDLER CO.,METTER,4/15/1999,1204,Tornado, ,F1,0,2,250000,0,GA,EST, ,2405803,C,43,CHS,0,0,NWS STORM SURVEY, ,9,100,7,W,2,N,METTER,4/15/1999,1215,32.4,-82.18,32.42,-82.07,"Tornado ripped the end off one mobile home, caused moderate damage to a house and practically destroyed seven other mobile homes. Another mobile home was flipped several times and ended up on the bottom of a nearby pond. Two persons were in this mobile home. The female landed at the edge of the water while the male was thrown into the pond and had to swim ashore.",,314,244,,
5238004,MILLER CO.,BOYKIN,3/12/2001,1715,Tornado, ,F1,0,2,500000,0,GA,EST, ,1112355,C,201,TAE,0,0,NWS STORM SURVEY, ,2,50,2,S,2,S,BOYKIN,3/12/2001,1720,31.08333,-84.7,31.08333,-84.68333,An F1 tornado touched down just west of U.S. Highway 27 in southern Miller County and tracked east to North Eldorendo Road before it disspiated.  Seven mobile homes were damaged.  A roof was torn off a frame house.  One frame house collapsed.  Several sheds were damaged.  One single-wide trailer was destroyed.  An irrigation system was damaged.  Storm damage surveyed by the NWS Tallahassee WCM.,,315,244,,
5319504,APPLING CO.,BAXLEY,11/5/2002,2345,Tornado, ,F0,0,2,200000,0,GA,EST, ,1144150,C,1,JAX,0,0,NWS STORM SURVEY, ,0.8,80,3,N,3,N,BAXLEY,11/5/2002,2345,31.8,-82.35,31.81667,-82.35,Along Ben Carter Road in Whispering Pines Mobile Home Park.  Three mobile homes destroyed and four damaged. Two wood frame residential structures damaged.  Pine trees snapped off and twisted. Numerous power lines down.,,316,244,,
5319584,COFFEE CO.,DOUGLAS,11/12/2002,745,Tornado, ,F2,0,2,500000,50000,GA,EST, ,1144160,C,69,JAX,0,0,NWS STORM SURVEY, ,3,200,7,SW,7,SW,DOUGLAS,11/12/2002,810,31.43333,-82.93333,31.45,-82.85,"Tornado touched down in field along the Atkinson-Coffee County line near Marshal Corbet Road.  Just inside of Coffee county one wood frame structure had a portion of its roof removed.  Three large 100 yard long chicken houses were totally destroyed and machinery tossed about.  One automobile was picked up and landed on the roof of a brick structure.  Extensive roof damage to brick structure.  Several work sheds destroyed.  Trees snapped off and twisted at tops with debris wrapped in tree tops.  Numerous large live oak trees felled.  Clear evidence of rotation was noted by investigating officials.  The storm continued north in a discontinuous path doing damage to cotton fields.  the tornado crossed Highway 135 at the Satilla River with trees again snapped and twisted at the tops.  Approximately 1 mile north of the Satilla River the tornado passed over an airstrip destroying a hanger/office structure and severely damaging a crop dusting aircraft.  Debris from the destroyed chicken houses was identified at this site some 3 miles from its point of origin.  This was the final discernable touchdown, although there was some evidence from debris further north that the system continued as a funnel cloud just above tree top level into southeast Douglas.",,317,244,,
5325957,EARLY CO.,BLAKELY,12/24/2002,755,Tornado, ,F1,0,2,750000,0,GA,EST, ,1146058,C,99,TAE,0,0,EMERGENCY MANAGER, ,15,150,9,WNW,9,WNW,BLAKELY,12/24/2002,810,31.43333,-85.08333,31.46667,-84.88333,The tornado crossed the state line from Henry County Alabama into Early County Georgia.  Its damage path extended from the Chattahoochee River northeast through Colomokee on U.S. Highway 27.  The tornado destroyed one mobile home and damaged thirty others.  Two persons were injured when their mobile home collapsed on them.  Numerous trees and power lines were down.  A state of emergency  was declared.  Reported by GEMA.,,318,244,,
5476117,SPALDING CO.,ORCHARD HILL,8/29/2005,1845,Tornado, ,F1,0,2,300000,0,GA,EST, ,1198457,C,255,FFC,0,0,NWS STORM SURVEY, ,1,100,5,N,5,N,ORCHARD HILL,8/29/2005,1847,33.58333,-83.61667,33.63333,-83.61667,A damage survey conducted by the National Weather Service concluded that an F1 tornado had touched down in a rural area of southeast Spalding county approximately five miles north of Orchard Hill in the vicinity of Wild Plum and McDonough Roads.  The tornado continued north from this location for approximately one mile.  The overall tornado path was one mile long and 100 yards wide.  One small home was completely destroyed and another nearby brick home under construction suffered major damage.  A sport utility vehicle was also damaged at this home when the garage collapsed.  Two people in the small home were injured during the tornado.  A few other homes nearby sustained minor damage.  A number of trees and some power lines were also down in the area.  A horse trailer was thrown about 200 yards from its original location.,,319,244,,
5489000,WORTH CO.,SYLVESTER,12/5/2005,1145,Tornado, ,F1,0,2,750000,0,GA,EST, ,1203154,C,321,TAE,0,0,NWS STORM SURVEY, ,1.1,75,1,WSW,1,WSW,SYLVESTER,12/5/2005,1150,31.53333,-83.86667,31.53333,-83.85,"A tornado touched down just southwest of downtown Sylvester, and moved east along Kelly Street where most of the damage occurred.  Nineteen businesses, two houses, three county buildings, and two non-profit organizations were damaged.  Two people were slightly injured by flying glass.  A half dozen power poles were snapped at the intersection of Livingston and West Streets.  Numerous trees were toppled.  Several vehicles were damaged.  Damage survey was provided by the NWS Tallahassee WCM, with  additional reports by the Worth County EMA.",,320,244,,
22391,WORTH CO.,SYLVESTER,3/2/2007,20,Tornado, ,EF2,0,2,275000,0,GA,EST-5, ,3979,C,321,TAE,0,0,NWS Storm Survey, ,4.55,150,7,SSW,2,S,SYLVESTER,3/2/2007,28,31.4432,-83.8922,31.4982,-83.85,"This tornado, rated EF-2, was spawned from the same supercell thunderstorm that produced the earlier tornado in Worth County.  It touched down near McCarty Road.  A brick frame house sustained severe roof damage with a couple of exterior walls collapsing.  Two vehicles parked outside were carried into a nearby field.  Large oak trees were uprooted, with one falling on a house.  One mobile home was flipped over and rolled into a nearby tree.  The tornado then moved northeast into a forest and uprooted hundreds of pines.  It flattened a house, causing two minor injuries, before lifting just west of State Highway 33.","Severe thunderstorms developed during the afternoon of March 1 ahead of advancing warm front across southwest Georgia, producing several reports of wind damage.  Later that evening into the predawn hours of March 2, a squall line formed ahead of a cold front, with several reports of wind damage and tornadoes across portions of southwest and south central Georgia.  One of the tornadoes tore through a mobile home park just north of Newton, killing six and injuring three.",321,244,,
27815,DODGE CO.,EASTMAN,4/15/2007,23,Tornado, ,EF1,0,2,350000,0,GA,EST-5, ,4857,C,91,FFC,0,0,NWS Storm Survey, ,4.48,100,1,W,4,NNE,EASTMAN,4/15/2007,28,32.2,-83.1971,32.2534,-83.1538,"A damage survey conducted by the National Weather Service in Peachtree City, Georgia confirmed that an EF1 tornado, with a maximum wind speed of 90 mph, had touched down about one mile west of downtown Eastman and traveled north-northeast to a point about four miles north-northeast of downtown Eastman.  The total path length of the tornado was 4.5 miles with a maximum path width of 100 yards.  A number of retail buildings on U.S. Highway 23 sustained minor damage.  However, an adjacent greenhouse was destroyed.  The announcers booth at the Eastman High School football field was destroyed.  Two unsecured mobile homes along the path of the tornado were destroyed.  A man and woman were injured when a home in the the Greenwood Heights Subdivision was destroyed.  Both injuries were the result of fallen and flying debris.  The home was destroyed by a large tree which crashed through the home.  Numerous trees and power lines were downed along the path of the tornado, several of which fell on and caused damage to homes.","The fourth tornado outbreak of the year for the Peachtree City, Georgia forecast area, and the second major tornado outbreak for the year, occurred across the southern portion of the forecast area, or central Georgia.  A broad upper trough over the central U.S. was tracking eastward while a surface low deepened rapidly as it moved from northern Mississippi into eastern Virginia.  A strong low-level jet accompanied the system with 50-60 knot winds observed at 850mb across central and south Georgia late in the day on the 14th.  The low-level jet transported deep Gulf moisture northward into the region. Sunshine during the early part of the day destabilized the region sufficiently to allow for strong to severe supercell thunderstorms to track across central Georgia just south of a warm frontal boundary across north Georgia.  Damage surveys confirmed that nine tornadoes tracked across central Georgia, including many of the same areas that were affected during the major tornado outbreak on March 1st.  The was the second most significant tornado outbreak to impact the Peachtree City, Georgia forecast area since the August 29, 2005 outbreak associated with Hurricane Katrinia.  The state insurance commissioner reported that at least 81 site-built homes, 28 mobile homes, and 10 businesses were damaged or destroyed during the event.  Damages to structures alone were near $5 million, with additional damages the result of downed trees and power lines.",322,244,,
75954,COLUMBIA CO.,WINFIELD,3/15/2008,1653,Tornado, ,EF1,0,2,140000,0,GA,EST-5, ,13584,C,73,CAE,0,0,NWS Storm Survey, ,5.28,440,1,WNW,4,W,SNEAD,3/15/2008,1703,33.605,-82.41,33.58,-82.19,Several mobile homes had moderate damage and one was destroyed.  Numerous trees and powerlines were down along path. Two people had minor injuries.,Three supercells tracked across portions of the GA CSRA and produce multiple long-lived tornadoes that produced significant damage.,323,244,,
109006,TATTNALL CO.,COBBTOWN,5/11/2008,639,Tornado, ,EF3,0,2,1000000,0,GA,EST-5, ,18553,C,267,CHS,0,0,NWS Storm Survey, ,4.5,200,10,NW,6,N,COBBTOWN,5/11/2008,644,32.31,-82.23,32.29,-82.13,"A confirmed EF-3 Tornado crossed into extreme northwestern Tattnall county from Toombs county, then continued east-southeastward into the community of Cobbtown, Georgia before turning east and dissipating. The first indications of significant damage, consistent with an EF-1 Tornado, occurred along Representative Kennedy Road where a mobile home was partially destroyed. A well defined path of debris was noted trailing southeast of this area across open farm fields. Several homes were also severely damaged with roofs blown off along Henry Moxley Road about 1 mile southeast of Representative Kennedy Road.||The Tornado continued to strengthen as it turned east toward Cobbtown, Georgia and peaked in intensity as it tracked near the intersection of Georgia State Highways 121 and 57. Here the Tornado completely leveled a brick convenience store and caused considerable damage to trees and nearby structures. Two people working in the store at the time of the Tornado were injured but not killed. The damage pattern in this area was consistent with an EF-3 Tornado with winds estimated between 140 and 150 mph. Also in this same general area, but south of the Tornado track there was evidence of a strong downburst. The winds were estimated to be around 100 mph with the downburst, likely associated with the rear flank downdraft of the Supercell Thunderstorm.||The Tornado continued to move east across open farm fields where extensive tree damage and minor structural damage consistent with an EF-1 and EF-0 Tornado was noted. The Tornado dissipated about 1.5 miles east of Cobbtown, however occasional bouts of non-tornadic straight line winds were observed across portions of northeast Tattnall County and northern Evans County near Undine, Georgia. ||Maximum sustained winds were estimated between 140 and 150 mph with a maximum width of approximately 200 yards. Considerable damage was reported along the path of the Tornado, and although no one was killed, 2 people were injured.","A warm front lifted northward through southern South Carolina and southeast Georgia during the morning, with a strong cold front then sweeping through the area during the evening. This resulted in several rounds of severe weather across the region.",324,244,,
167123,CHEROKEE CO.,WOODSTOCK,4/19/2009,2200,Tornado, ,EF1,0,2,5000000,0,GA,EST-5, ,28402,C,57,FFC,0,0,NWS Storm Survey, ,1.46,880,4,ESE,4,WSW,ARNOLD MILL,4/19/2009,2203,34.0825,-84.4559,34.0942,-84.4347,"A damage survey conducted by the National Weather Service Forecast Office in Peachtree City, Georgia confirmed that an EF1 tornado touched down in far southeast Cherokee county near the Cobb county line in the Woodstock area.  The tornado touched down near the intersection of Georgia Highway 92 and Dial Drive, then continued north-northeast along Dial Drive crossing a large section of Coleman's Bluff.  The tornado lifted just south of the intersection of Windcrest Court and River Chase Drive.  The total path length of the tornado was 1.5 miles with a maximum path width of 1/2 mile or 880 yards.  Maximum winds were estimated to be 90 mph.  EF1 tornado damage to trees and structures was observed along a 3/4 mile-long path paralleling Dial Drive beginning just north of its intersection with Georgia Highway 92.  Damage was observed to 120 homes along the path of the tornado, 12 of which were completely destroyed.  The majority of the damage took place in the Coleman's Bluff area.  Most of the damage was the result of large trees falling on the structures.  Two residents of the affected homes were injured by debris.","Yet another deep upper trough was translating across the south central and southeast United States accompanied by a strong Pacific cold front.  Although instability was marginal for the time of year, the upper atmosphere was highly sheared with a strong low-level jet.  Showers and a few thunderstorms moved across the area during the day, but it was during the late evening hours when the front moved into the area from the west that strong to severe thunderstorms developed across eastern Alabama and moved into western Georgia.  The activity took on the form of a squall line with distinct bowing segments.  Two EF1 tornadoes were spawned within this line of thunderstorms causing considerable damage to homes and businesses in the Columbus and Woodstock areas.  The activity quickly dissipated shortly after midnight as it moved further east into central and northeast Georgia.",325,244,,
207948,APPLING CO.,SURRENCY,12/2/2009,1520,Tornado, ,EF2,0,2,0,0,GA,EST-5, ,34329,C,1,JAX,0,0,NWS Storm Survey, ,3.69,440,14,S,10,S,SURRENCY,12/2/2009,1530,31.5232,-82.2203,31.5695,-82.189,"The tornado first touched down at approximately 1415EST in northwest Pierce County near Merson Road and Crump Road. It crossed the Big Satilla Creek, entering into Appling County at this point, and continued on a northeast track. The funnel may have briefly lifted off the ground at this point. The next significant damage occurred along Metts-Overstreet Road with the complete destruction of a singlewide mobile home and a farm shed at approximately 1425EST. Additionally, at this location, a brick cider block structure had one wall knocked over. The tornado then moved into a dairy just west of the intersection of State Road 15 and Wireglass Road. The event was rated as an EF-2 with winds of 135 mph at this location. Three metal building structures were destroyed with one removed from its foundation and blown into a pile of scrap metal. It is possible the funnel may have approached EF-3 at this particular location with winds of 140 to 150 mph; however, other damage to frame and masonry structures at the dairy suggested a lower wind value should be assigned to this area. One individual escaped injury by jumping into a depressed area inside one of the structures before it blew down around her. East of State Road 15, along Wireglass Road, extensive tree blow down and snapping continued in a tree farm. Once again the funnel likely lifted off the ground touching down again at 1430EST near 4230 Antioch Church Road destroying a doublewide mobile home. At this location, two middle aged individuals were in the bedroom, preparing for work, when the funnel destroyed the mobile home. Both escaped with only minor cuts despite the fact that the doublewide was completely obliterated and the frames bent. Once again at this location the winds were rated at 135 mph for a strong EF-2 rating.","Strong mid and upper low initially over Texas was moving east-northeast while the upper level trough it was embedded in became negatively tilted. This led to a broad diffluent pattern over most of the southeastern states. As the system approached the right rear quadrant of upper jet moved into the forecast area coincident with a low-level jet of, at least, 60 knots. This created atmospheric dynamics favorable for severe weather, with the only limiting factor being modest instability. A warm front over the area during the morning moved rapidly north in response to increasing southerly flow allowing a gradual increase in low level instability. By afternoon several severe weather events and three tornadoes occurred over portions of southeast Georgia.",326,244,,
355116,HARRIS CO.,BARTLETTS FERRY LAKE,11/16/2011,1335,Tornado, ,EF2,0,2,5000000,0,GA,EST-5, ,59408,C,145,FFC,0,0,NWS Storm Survey, ,26.2,880,3,WNW,1,ENE,SHILOH,11/16/2011,1408,32.697,-85.1173,32.8232,-84.692,"A damage survey conducted by the National Weather Service Forecast Office in Peachtree City, Georgia confirmed that an EF2 tornado caused extensive damage across Harris county.  The tornado first touched down as an EF1 in Macon county, Alabama before moving east into Lee county, Alabama and then into Harris county, Georgia.  The tornado had already caused considerable damage to the town of Auburn, Alabama as an EF1 before it continued into Harris county, Georgia.  As the tornado approached the county seat of Hamilton, it strengthened to an EF2. The tornado entered Harris county from Alabama at the north end of Lake Harding and tracked across the central part of the county, then moved into extreme northwest Talbot county before lifting, approximately two miles east-northeast of the town of Shiloh on the Harris/Talbot county line.  The tornado had already carved out a path over 33 miles in length across eastern Alabama before it moved into Georgia.  Within Harris county, the tornado path length was approximately 26 miles.  The maximum path width was determined to be 1/2 mile with maximum winds of 125 mph.  The tornado caused considerable damage across Harris county, especially around the county seat of Hamilton.  Two homes were completely destroyed, with 68 other structures suffering minor to moderate damage, including 22 county buildings.  County buildings damaged included the Harris County School Complex, the Harris County 911 Center, the Harris County Animal Shelter, and the agricultural center.  One of the structures heavily damaged was a mobile home, where a man and his wife sustained minor injuries.  Hundreds of trees were snapped or uprooted along the path of the tornado.||[11/16/11:  Tornado #1, County #1-2, EF2, Harris-Talbot, 2011:026].","A sharp and deep negatively tilted full-latitude upper trough was sweeping through the eastern half of the United States.  An unseasonably warm, moist air mass was present in advance of the front, as was the case with many events during the 2011 - 2012 winter season.  In addition, a strong low-level jet contributed highly to a high shear/high helicity environment and the development of rotating cells within a quasi-linear convective system (QLCS) that tracked from west central to east central Georgia during the afternoon.  An EF2 tornado tracked from Lee county in east central Alabama into Harris county in west central Georgia.  In addition, there were several reports of quarter-sized hail and thunderstorm wind damage, primarily across central Georgia during this event.",327,244,,
464404,CHEROKEE CO.,WALESKA,6/13/2013,1800,Tornado, ,EF1,0,2,60000,0,GA,EST-5, ,76975,C,57,FFC,0,0,NWS Storm Survey, ,8.5,75,4,S,1,SSE,UNIVETER,6/13/2013,1825,34.2662,-84.5574,34.1705,-84.4666,"A National Weather Service storm survey team determined that an EF-1 tornado touched down near the intersection of Patriot Trail and Rampley Trail, causing mainly tree damage as it headed southeast toward Canton.  Along Marietta Road and Hickory Flat Highway, a Chevron gas station sustained roof damage, and a gas pump was blown over.  Dozens of trees were snapped or uprooted.  The tornado then headed south-southeast causing additional tree damage, lifting near the intersection of New Light Road and Hickory Road.  Two minor injuries occurred in Canton as a result of trees falling.|[06/13/13: Tornado #1, County #1-1, EF1, Cherokee, 2013:011].","A strong shortwave moved from the Ohio Valley into the Mid Atlantic States during the day.  A surface cold front pushed into north Georgia ahead of the shortwave during the morning, progressing into central Georgia during the afternoon hours.  Temperatures climbed into the 90s across most of the area with strong instability in place as well as deep layer shear, supportive of severe thunderstorm development.  Numerous severe thunderstorms did indeed develop with mainly downed trees and some large hail, but two small tornadoes also touched down.",328,244,,
